Patent Number,Title,Unique Identifier,
CN120383522-A,"Use of Rh1@zeolite molecular sieve confined single-atom rhodium-based material for catalyzing hydroformylation of olefins, preferably for selectively catalyzing hydroformylation of olefin molecules with molecular size smaller than the pore size of the molecular sieve.",DIIDW:202578067Q,
CN116854103-A; CN116854103-B,"One-step method for rapidly synthesizing fly ash-based nano-iron-coppper-SSZ-13 zeolite involves mixing fly ash and solid sodium hydroxide, calcining, cooling, dissolving obtained fly ash clinker and sodium hydroxide in water, adding tetraethylene pentamine, crystallizing, filtering and drying.",DIIDW:2023A81502,
CN103539146-A; CN103539146-B,"Hydrothermal synthesis of silicoaluminophosphate zeolite comprises adding ionic liquid, silicon source, aluminum source, phosphorus source, template agent and mineralizer, stirring, crystallizing, washing and distilling.",DIIDW:2014F29877,
CN108059171-A; CN108059171-B,"Synthesis of HZSM-5 type zeolite, involves adding sulfuric acid solution to fly ash, reacting, cooling, filtering, washing, drying, adding tetrapropylammonium bromide template, dissolving, filtering, aging, and hydrothermally reacting.",DIIDW:201841785Q,
BR102013005460-A2; BR102013005460-B1,"Synthesizing zeolite for use in catalytic processes, ion exchange and bactericidal agent, involves collecting and screening ash from sugar cane bagasse, and then preparing zeolitic material.",DIIDW:2015226205,
CN111269254-A; CN111269254-B,"Microwave synthesis method of 1,3-bis(2-(3,4-epoxycyclohexyl)ethyl)tetramethyldisiloxane, by reacting tetramethyldisiloxane, organic solvent, 4-vinyl-1,2-epoxycyclohexene, catalyst and absolute ethanol, decompressing and centrifuging.",DIIDW:202054982R,
BR102022012503-A2,"Synthesis of type A zeolite used for replacement of sodium tripolyphosphate in water softening, involves grinding aluminum residue and coal ash to obtain homogeneous material, adding alkaline hydroxide pellets and water, and heating.",DIIDW:202418112C,
CN117185957-A,"Synthesizing salicylonitrile useful in continuous multi-phase catalytic synthesis field of fine chemical product, comprises synthesizing methyl salicylate and ammonia as reaction raw materials through two stages of continuous gas-solid heterogeneous catalytic reaction.",DIIDW:2023D1278B,
GB2339774-A; GB2339774-B,Process for the synthesis of fly ash based zeolite-Y for use as a catalyst in car exhausts.,DIIDW:2000197599,
WO200266579-A1; RU2188225-C1; AU2002239193-A1,Production of aromatic hydrocarbons from feeds comprising methane and higher hydrocarbons uses selected zeolite or aluminophosphate catalysts.,DIIDW:2002643533,
US2013064747-A1; US8673057-B2,Forming zeolite membranes on porous substrate used e.g. to seal zeolite membrane defects involves seeding substrate with zeolite crystals of uniform size; and incubating in growth solution of 1-adamantanamine/silica/water/potassium fluoride.,DIIDW:2013D75139,
CN101983921-A,"Synthesizing zeolite socony mobil-5 zeolite with regularly-stacked nano-crystals, comprises preparing and mixing A, B, C and D solutions, and adding crystal seed solution to form reaction liquid and crystallizing, and washing and drying.",DIIDW:2011E30920,
CN104556096-A,"Two-step crystallization synthesis of sub-micron BEA zeolite involves mixing tetravalent element, trivalent element, alkali source and water, carrying out hydrothermal pre-crystallization reaction, and crystallizing obtained sample.",DIIDW:201540100U,
CN107216346-A,"One-pot synthesis of high purity dimethyl cadmium comprises taking magnesium powder, cadmium halide, methyl halide and ether, synthesizing raw materials in reaction tank; separating crude product, and purifying product.",DIIDW:201769817H,
CN107324354-A,"Hydrothermal-treatment method for synthesis of beta-zeolite used in preparation of catalytic cracking catalyst, using sodium type beta-molecular sieve to exchange sodium ion by ammonium cation in ammonium salt or organic ammonium solution.",DIIDW:201777193Y,
WO9957225-A1; AU9936670-A; US6093867-A; BR9910216-A; EP1112336-A1; CN1299402-A; KR2001043263-A; MX2000010670-A1; JP2002513845-W; AU762178-B; TW510894-A; MX213111-B; EP1112336-B1; DE69918139-E; DE69918139-T2; CN1189542-C; IN200000526-P3; KR588891-B1; IN208417-B; EP1112336-A4,"Production of olefins containing 3 carbons for use in alkylation, oligomerization, methyl tertiary-butyl ether (MTBE) and ethyl tertiary-butyl ether (ETBE) synthesis processes.",DIIDW:2000038806,
JP2007181796-A; JP5261875-B2,"Adsorption agent for humidity-control sheet, is three dimensional structure containing aluminum, phosphorus and six-membered oxygen ring, and has preset pore diameter.",DIIDW:2007694268,
CN1524788-A; CN1205121-C,Synthesizing method for MOR zeolite comprising zinc.,DIIDW:2005000197,
CN1145278-A; CN1079780-C,"Synthesis of hyper silicon zeolite and hetero-atom isomorphism substituted derivative prepared by adding crystal seed or guiding agent to high concentration of reaction gel system, etc..",DIIDW:2001081259,
WO9807516-A1; AU9739153-A; US5808167-A; US5977008-A,Higher selectivity and stability benzene hydroxylation catalyst prepared by treating a zeolite catalyst with aqueous solutions containing ferric and then di:thionate ions.,DIIDW:1998168954,
CN109369381-A,"Synthesizing medicinal intermediate para-bromobenzoic acid comprises e.g. grinding, sieving the mica powder, grinding with natural zeolite powder, clay, ammonium polyphosphate, sintering, refluxing, filtering and drying.",DIIDW:201920412E,
WO2016038629-A1; IN201402585-I1; US2017283361-A1; US9988337-B2; IN336732-B,"Single step transesterification process for the preparation butyl acetate which is useful e.g. high-grade paints and inks, comprises heating a reaction mixture of n-butanol, ethyl acetate and boron loaded zeolite (B-ultra stable Y) catalyst.",DIIDW:201616534X,
DE2830830-A; BR7907732-A,"Crystalline arsenic silicate zeolite useful as catalyst - e.g. in methanol conversion to olefin cpd., is produced by hydrothermal synthesis from silica and arsenic tri:oxide.",DIIDW:198009300C,
RU2022134145-A; RU2821943-C2,"New including cobalt catalyst with aluminum additive on silica gel carrier, zeolite socony mobil-23 in hydrogen-form and boehmite binder, used for synthesizing hydrocarbons of iso- and branched structure from carbon monoxide and hydrogen.",DIIDW:2024A06026,
RU2778923-C1,METHOD FOR OBTAINING CRYSTALLINE ZEOLITE,DIIDW:2022C83489,
US6355793-B1; TW531530-A,"Organometallic zeolite used as molecular sieves, sorbents, ionic exchange materials, biosensors, has multiple units.",DIIDW:2002424434,
US4354963-A,Iron catalysts based on ZSM-type zeolite for converting synthesis gas to naphtha.,DIIDW:198294913E,
CN104760971-A; CN104760971-B,"Synthesis of beta-zeolite alkali metal ion comprises contacting organic templating agent and aluminum source, mixing with silicon source, hydrothermally crystallizing under autogenous pressure, and recovering product.",DIIDW:201556015C,
KR2020062701-A; KR2203335-B1,"Preparing synthetic natural gas having improved caloric value, comprises e.g. gasifying fuel to obtain syngas, converting syngas by aqueous gas conversion reaction and separating part of syngas by aqueous gas conversion reaction.",DIIDW:2020502569,
WO2014063758-A1; CA2886918-A1; AU2012393260-A1; CN104736473-A; EP2911975-A1; IN201502290-P1; US2015299594-A1; MX2015003867-A1; CN104736473-B; BR112015009119-A2; EA28542-B9; EA28542-B1; ZA201502937-A,"Preparing higher hydrocarbons boiling in gasoline range by mixing feed gas with hydrogenated tail gas, reforming mixed feed gas to methanol synthesis gas, followed by separating raw product into hydrocarbon fraction and hydrogenating.",DIIDW:2014H85583,
RO86668-A,High silicon zeolite ZSM-5 porous crystalline aluminosilicate mfr. - by hydrothermal synthesis with crystallising agent and gelling.,DIIDW:1986053521,
JP4063140-A; JP95090171-B2,"Zeolite catalyst for treatment of e.g. waste gases contg. alloy fine particles of two of platinum@, rhodium, palladium@, iridium, cobalt@copper@, for hydrocarbon and/or alcohol syntheses.",DIIDW:1992119924,
CN103303939-A; CN103303939-B,"Preparation of natural cinerite synthetic nanometer zeolite molecular sieve functional material involves performing hydrothermal synthesis reaction to powder of natural ash and alkaline reaction medium, and immersing in deionized water.",DIIDW:2013V83658,
DD233494-A,"Converting synthesis gas to low olefin cpds. - with high catalyst stability, using mixt. of carbon mon:oxide redn. catalyst and zeolite exchanged with gp. 2A metal ions in alkaline soln..",DIIDW:1986169746,
CN104445248-A,"Amine-free synthesis of beta-zeolite molecular sieve by mixing alkali source, silicon source, aluminum source, water and seed crystal into gel, transferring into reaction kettle, crystallizing under autogenous pressure, washing and drying.",DIIDW:201529332N,
CN102030340-A,"Preparation of mesoporous MCM-41 molecular sieve containing ZSM-5 secondary structure unit by mixing industrially synthesized ZSM-5 zeolite with acid solution to prepare hydrogel, mixing hydrogel with template agent, and crystallizing.",DIIDW:2011G21615,
CN105712376-A,"Synthesizing NaY zeolite involves mixing silicon-containing substance, acidic aluminum salt, sodium aluminate, sodium aluminate or guide to form gel.",DIIDW:201643160Q,
CN1082510-A; CN1033079-C,Prepn. of zeolite molecular sieve by kneading process.,DIIDW:1995170810,
US2015275098-A1; US9404048-B2,"Production of hydrocarbon fuel products from synthesis gas, comprises single reactor system and dinuclear metal based catalyst, where chemical reactions occur in single reactor system.",DIIDW:2015595835,
CN104888838-A; CN104888838-B,"Core-shell type synthesis gas direct-preparing low carbon olefin catalyst used for fixed bed Fischer-Tropsch synthesis comprises active component comprising cobalt oxide and manganese oxide, metal oxide additive, and carrier.",DIIDW:201565623T,
EP1129991-A1; WO200164581-A1; AU200135495-A; NO200203950-A; EP1259461-A1; BR200108826-A; KR2002092372-A; US2003103894-A1; CN1422236-A; EP1259461-B1; MX2002008413-A1; DE60100708-E; ZA200206952-A; ES2204834-T3; JP2004517019-W; US6841144-B2; RU2256613-C2; IN200200921-P2; CN1280192-C; KR758142-B1; CA2399192-C; IN238728-B; BR200108826-B1; JP4778183-B2; MY128020-A,Production of titanium-containing zeolites useful as olefin epoxidation catalysts comprises using a defined nitrogen/silicon ratio to increase the titanium content of the product.,DIIDW:2001566806,
US2004004026-A1; US6881323-B2,"Process for converting hydrocarbons, e.g. isomerization, (trans)alkylation or catalytic cracking, involves contacting hydrocarbon feed at hydrocarbon converting conditions with catalyst comprising calcined zeolite.",DIIDW:2004167460,
CN104418749-A,Improved carbonylation of methanol to dimethyl carbonate comprises performing first-stage synthesis reaction and second-stage synthesis reaction.,DIIDW:2015280472,
CN1320558-A; CN1194892-C,"Synthesis of silicon-aluminum zeolite, involves synthesizing hydrothermally using templating agent, which is mixture of hexamethyleneimine, caprolactam, water and molecular sieve, and crystallizing.",DIIDW:2002123171,
CN1154341-A; CN1048697-C,Method for synthesis of beta-zeolite.,DIIDW:2003768492,
CN107032954-A,Producing methanol or its derivatives by coal underground gasification product gas comprises e.g. producing appropriate economies of scale coarse synthesis gas by number of underground gasifier.,DIIDW:201755707A,
WO2012118410-A2; WO2012118410-A3; RU2012131826-A; RU2514076-C2,"Underground disposal of carbon dioxide by injection of carbon dioxide into water-bearing strata, comprises selecting underground water-bearing stratum, catchment area and active filtration regime, and identifying local trap in stratum.",DIIDW:2012L68131,
WO9802384-A1; FR2750893-A1; ZA9706174-A; EP915808-A1; CN1227532-A; BR9710298-A; MX9900527-A1; JP2000514392-W; US6146613-A; KR2000023727-A; EP915808-B1; DE69708103-E; ES2167760-T3; RU2182114-C2; MX205885-B; CA2259951-C; CN1146525-C; KR567473-B1; JP4322961-B2,"Synthesis of zeolites such as EMO, EMT, Gmelinite and Mazzite using a reactor containing a helical rotor, producing laminar flow in the reactor, producing zeolites with a high degree of crystallinity..",DIIDW:1998110487,
CN111530412-A,"Synthesis of synchronous denitrification and dephosphorization adsorbent based on natural zeolite used for advanced treatment of sewage, by alkali dissolving natural zeolite in sodium hydroxide solution and adding sodium aluminate solution.",DIIDW:202080789E,
CN101353168-A; CN101353168-B,"Synthesis of nanoaluminum-rich beta zeolite for synthesizing nanoaluminum-rich H-beta zeolite, comprises mixing aluminum source and acid, mixing silicon grains, drying, crushing, mixing template agent, crystallizing, and recycling.",DIIDW:2009E89796,
CN107866268-A; CN107866268-B,"Catalyst useful for synthesis of cyclohexylbenzene, comprises carrier including hydrogen-type zeolite molecular sieve and active component including palladium, lanthanide element and zinc.",DIIDW:2018271699,
SU910562-B,"Synthesis of isopropyl-benzene intermediate - by catalytic propylation of benzene, using de:aluminised zeolite with prescribed silica to alumina ratio as catalyst.",DIIDW:198303915K,
CN110577228-A; CN110577228-B,"Synthesizing porous ETS-10 zeolite molecular sieve for biomass catalysis, by using water glass as silicon source, titanium trichloride as titanium source and sodium carboxymethyl cellulose as additive and performing hydrothermal synthesis.",DIIDW:202000106N,
CN105289324-A; CN105289324-B,"Method for preparing silicalite-1 zeolite membrane, involves using silica or porous alumina ceramic tube vector, soaking, drying, filling with organic matter and preparing synthetic liquid, followed by performing hydro-thermal synthesis.",DIIDW:2016100153,
CN1680245-A; CN1286792-C,"Synthesis of 1,2-butyl keto-aldehyde is carried out by catalyzing 1,2-butanediol with nanometer silver zeolite membrane as catalyst through gas-phase dehydrogenation, oxidation and electrolytic process.",DIIDW:2006111678,
KR2004028141-A,Methods for synthesizing amorphous material and zeolite from layered minerals by mechanochemical treatment.,DIIDW:2004540670,
JP9175818-A; JP3767041-B2,Synthesis of beta zeolite comprises contacting raw material powder only with water vapour.,DIIDW:1997399308,
FR2934794-A1; WO2010015737-A1; FR2934794-B1; EP2313344-A1; US2011180455-A1; RU2011108550-A; RU2501736-C2; EP2313344-B1; US9586828-B2; KZ27376-B,"Preparing middle distillates (e.g. diesel) from paraffin charge produced by Fischer-Tropsch synthesis comprises implementing catalyst for hydrocracking/hydroisomerizing, comprising hydro-dehydrogenating metal and support comprising zeolite.",DIIDW:2010B61704,
CN106430234-A; CN106430234-B,"Synthesis of nano-multi-stage pore zeolite socony Mobil-11 molecular sieve involves subjecting calcined kaolin to acid treatment through acid solution to obtain modified kaolin, adding with silicon source and organic templating agent.",DIIDW:201715150P,
CN1834014-A; CN100413784-C,Synthesis of Y-zeolite and MAPO-5 two-structure molecular sieve.,DIIDW:2007272936,
CN106745053-A,"Preparation of methanol to propylene catalyst via zeolite molecular sieve microwave synthesis method involves taking sodium hydroxide and deionized water, adding template and silica, stirring, and adding aluminum source.",DIIDW:2017375224,
CN106699665-A,"Preparing zeolite imidazole ester frame material by solvent thermal synthesis method comprises e.g. adding metal salt and imidazole derivative ligand into dimethylformamide, mixing and post-processing.",DIIDW:2017353789,
SU298160-A,"Synthesis of crystalline zeolite - by reacting hydroxy-aluminate and silicate ions, in presence of phosphate or arsenate, and ammonium chloride.",DIIDW:197917354B,
RU2063805-C1,"Zeolite-contg. catalyst for synthesis of aliphatic amines contains kaolin, alumina and additionally aluminium phosphate and magnesium oxide.",DIIDW:1997143840,
CN117361555-A; CN117361555-B,"Trans-crystallization synthesis of MOR zeolite molecular sieve involves mixing natural clinoptilolite raw powder, hydroxide and/or oxide of alkali metal, silicon source and water to obtain mother liquor, and hydrothermally crystallizing.",DIIDW:2024092668,
US5276215-A,"One step synthesis of alkylphenol from phenol and olefin - using zeolite as catalyst, esp. dealuminated Y-zeolite.",DIIDW:1994016137,
JP2221114-A; JP95045321-B2,"Zeolite synthesis - by boiling slurry of sodium-hydroxide aq. soln. and fly ash, etc..",DIIDW:1990310103,
CN102836742-A; CN102836742-B,"Preparation of titanium-containing zeolite molecular sieve modified palladium catalytic film involves preparing zeolite seed crystal precursor solution and palladium-containing zeolite seed crystal film, and crystallization reacting.",DIIDW:2013E66144,
CN106587100-A; CN106587100-B,"Synthesis of flake ZSM-5 zeolite involves mixing water, silicon source, alkali source and template agent, adding aluminum source to reaction kettle and mixing, crystallizing reaction product, filtering and drying.",DIIDW:201727866E,
CN1834013-A; CN100386261-C,Synthesis of beta zeolite and MAPO-5 two-structure molecular sieve.,DIIDW:2007272935,
CN104974014-A; CN104974014-B,"Production of methanol involves mixing coke oven gas and coal-based synthesis gas, methane reforming, compressing, purifying, removing hydrogen sulfide, recovering sulfur, separating methane, compressing and membrane separating.",DIIDW:201569532Y,
CN107796887-A; CN107796887-B,"Preparing zeolite imidazolate framework material ionic liquid organic polymer stationary phase capillary monolithic column for separation alkylbenzenes, involves performing one-step synthesis of organic polymer.",DIIDW:2018221044,
SU425896-A,"Synthesis of alpha-tetralone - by liquid phase oxidation of tetralin, using cobalt-contg zeolite as catalyst.",DIIDW:197526907W,
JP2003226673-A; JP4205347-B2,"Purification of trifluoromethyl hypofluorite used as reagent for organic synthesis, involves reacting trifluoromethyl hypofluorite with zeolite followed by absorbing and removing impurities in trifluoromethyl hypofluorite.",DIIDW:2003725695,
WO2014200633-A1; CA2913033-A1; CN105283416-A; US2016090308-A1; SG11201509191-A1; EP3008015-A1; JP2016523221-W; US9550684-B2; ZA201508175-A; SG11201509191-B; CN105283416-B; JP6422488-B2,"Preparing molecular sieve, used for olefin oligomerization process, comprises preparing synthesis mixture comprising e.g. source structure directing agents, crystallizing the mixture to form molecular sieve and then separating.",DIIDW:2014W39494,
KR2015142465-A; KR1607960-B1,"Producing MFI zeolite useful as seed of membrane, comprises preparing zeolite nanocrystals, preparing zeolite synthesis solution by mixing e.g. silica raw material with water, and performing hydrothermal synthesis.",DIIDW:201601140V,
JP2019202929-A; JP7207154-B2,"Manufacture of zeolite used as e.g. adsorbent and catalyst, involves adding solvent containing organic solvent to treatment liquid containing organic structure-defining agent which is obtained by zeolite hydrothermal synthesis.",DIIDW:201999657C,
US2015360964-A1; US10173903-B2,"Forming zeolite material used as catalyst, comprises combining framework source precursor, adamantane structure directing agent, organic zeolite growth modifier, and solvent and maintaining synthesis mixture at specified conditions.",DIIDW:201580801T,
FR3063995-A1; WO2018167417-A1; TW201838919-A; KR2019118200-A; CN110446684-A; IN201917036538-A; EP3596012-A1; TW676598-B1; US2020048102-A1; JP2020509987-W; EA37046-B1; ZA201905758-A; MX2019010517-A1; IN364652-B; KR2291888-B1; JP6961010-B2; US11377361-B2; CN110446684-B,"Preparing zeolite crystals having multimodal particle size distribution, comprises preparing synthesis gel, supplying reactors with synthetic gel, conducting crystallization reaction, mixing reaction media of reactors and filtrating mixture.",DIIDW:201873631P,
FR3063996-A1; WO2018167415-A1; TW201838921-A; CN110418768-A; KR2019126096-A; IN201917036360-A; TW673234-B1; EP3596013-A1; JP2020510602-W; US2020216325-A1; US10850988-B2; ZA201905756-A; EA37002-B1; MX2019010519-A1; KR2282810-B1; FR3063996-B1; CN110418768-B; IN494501-B,"Synthesis of zeolite X crystals e.g. zeolite FAU crystals, involves adding seeding agent(s) to synthesis gel at preset temperature.",DIIDW:201873631N,
JP2020024918-A; JP6746763-B2,"Power generation system used e.g. for electric vehicle, comprises zeolite membrane for separating carbon dioxide from carbon dioxide-containing gas, methanol synthesis device having methanol synthesis unit, and fuel cell to generate power.",DIIDW:202012827D,
JP2017144426-A; JP6830828-B2,"Catalyst for manufacturing hydrocarbon from synthesis gas comprises Fisher-Tropsch synthesis catalyst which has cobalt supported by alumina support, and beta-zeolite film formed on outer surface of Fisher-Tropsch synthesis catalyst.",DIIDW:201757485D,
JP2018143911-A; JP6773586-B2,Manufacturing catalyst for producing hydrocarbon from synthesis gas by treating catalyst with alkaline aqueous solution in which beta-zeolite is formed on outer surface of Fisher-Tropsch synthesis catalyst having cobalt on alumina support.,DIIDW:2018741959,
JP2002137917-A,"Continuous synthesis of zeolite involves passing slurry containing zeolite raw material and aqueous alkaline solution through reaction tube continuously, and heating slurry.",DIIDW:2002611416,
US2010119736-A1,"Production of zeolite films or membranes at ambient pressure by preparing synthesis mixture comprising ionic liquid solvent and aluminum, silicon, and/or phosphate source, and converting synthesis mixture to form continuous zeolite layer.",DIIDW:2010F15907,
US2012202006-A1; WO2012106675-A2; WO2012106675-A3,"Forming a zeolite material used as catalyst for petroleum refining, comprises combining framework source precursor, zeolite growth modifier and solvent, and maintaining the mixture at predetermined temperature for predetermined time.",DIIDW:2012K45461,
CN111519173-A; CN111519173-B,"Preparation of zeolite coating involves depositing thin layer of silica gel and small particles of zeolite on surface of steel mold, depositing silica gel layer, promoting growth of small particles of zeolite, and stacking.",DIIDW:202078662E,
CN105268328-A; CN105268328-B,"Preparing zeolite membrane comprises providing a solid support, carrying out surface functional modification of the solid support, then subjecting the modified surface support to hydrothermal synthesis.",DIIDW:201611961Y,
EP999182-A1; DE19961405-A1; FR2785201-A1; FR2785279-A1; FR2787780-A1; JP2000143236-A; JP2000185913-A; NL1013892-C2; CN1260238-A; CN1260239-A; ZA9907664-A; US6342200-B1; US6514479-B1; EP999182-B1; DE69907849-E; CN1128672-C; CN1177646-C; IN9901204-I4; IN210180-B; IN9901029-I4; JP4595106-B2; JP4880104-B2,"Synthesis of a zeolite of structural type EUO, useful for e.g. the preparation of isomerization catalysts for eight carbon aromatic hydrocarbons, with the aid of seeds of another zeolitic material.",DIIDW:2000453481,
IN201921013925-A; IN381679-B,"Preparing zeolite intergrowth material for e.g., catalysis, by preparing synthesis gel of zeolite 1, adding zeolite 2 in synthesis gel of zeolite 1, crystallizing obtained gel to obtain crystallized material, separating, and drying.",DIIDW:2020A16071,
WO2008121228-A1; US2008253959-A1,Synthesizing crystalline molecular sieve e.g. zeolite involves forming aqueous synthesis mixture; crystallizing; separating sieve crystals to form solid phase of crystals/supernatant liquid phase; and decanting liquid phase from solid phase.,DIIDW:2008L74566,
CN104549464-A; CN104549464-B,"Mordenite/beta zeolite/zeolite composite material has three crystal forms containing core comprising zeolite, and shell containing beta-zeolite and mordenite and having specified specific surface area.",DIIDW:201540275Y,
US2009042717-A1,"Catalyst used for producing liquefied petroleum gas used as industrial fuel for portable gas burner, and automobile fuel, contains palladium-based methanol synthesis catalyst component and (beta)-zeolite catalyst component.",DIIDW:2009F00454,
JP2005306632-A; JP3940801-B2,"Synthesis of zeolite, used as moisture absorption material, involves dissolving coal ash in sodium hydroxide-sodium aluminate mixed solution and passing through semipermeable membrane.",DIIDW:2005773933,
CN103073020-A,"Preparation of hierarchical zeolite molecular sieve for preparing e.g. 2,6-dimethylnaphthalene involves preparing zeolite seed solution, grafting organic silane on zeolite seed crystal, and preparing zeolite synthesis mother liquor.",DIIDW:2013Q22046,
CN104528756-A; CN104528756-B,Rare earth-containing zeolite has specified molar ratio of rare-earth oxide and silica and molar ratio of silica and alumina.,DIIDW:201537374X,
JP2024095452-A,"Mixed catalyst used for producing dimethyl ether, comprises methanol synthesis catalyst containing copper and zinc and dehydration catalyst containing zeolite, where zeolite contains phosphorus, MFI type zeolite, and zeolite supports precious metal.",DIIDW:2024727727,
JP2012066977-A; CN102557064-A; IN201103331-I4; CN102557064-B,"Manufacturing method of zeolite for epsilon-caprolactam manufacture involves aging liquid mixture containing silicon compound, water, and structure-defining agent, crystallizing, and performing hydrothermal synthesis reaction of mixture.",DIIDW:2012D86584,
WO2011155955-A1; US2011306686-A1,"Forming a catalyst for synthesis gas conversion comprises impregnating a zeolite extrudate with ruthenium using a solution comprising a ruthenium salt to provide an impregnated zeolite extrudate, and activating the impregnated zeolite.",DIIDW:2011Q28349,
