Patent Number,Title,Unique Identifier,
TR201509919-A,"Synthesis of zeolite used e.g. as detergent builder and desiccant, involves mixing sodium feldspar with sodium hydroxide, calcining, mixing activated product with water and alumina source, forming gel, heating, filtering, washing and drying.",DIIDW:2017245317,
CN106379913-A,"Method of synthesizing P-type zeolite molecular sieve, involves adding rice husk ash, sodium hydroxide and water, heating, activating to obtain activated alkali solution and mixing aluminum source and water with activated alkaline solution.",DIIDW:201711375V,
CN116283716-A; CN116283716-B,Method of using copper/zeolite heterogeneous catalyst to synthesize 3-methyleneisoindolin-1-one involves heating and reacting 2-iodobenzamide and terminal alkyne in presence of copper/zeolite catalyst and solvent under nitrogen atmosphere.,DIIDW:202370099V,
JP9313903-A; JP3342294-B2,"Zeolite separation membranes preparation - by loading pores of porous alkali-resistant metal with zeolite seed crystals, immersing in zeolite slurry, and growing seed crystals by hydrothermal synthesis.",DIIDW:1998080724,
US2017305753-A1; WO2017184225-A1; US9890051-B2; CN108698843-A; KR2018136505-A; EP3445715-A1; JP2019514818-W; EP3445715-B1; JP6824281-B2,"Synthesizing zeolite, comprises preparing reaction mixture of source of silicon oxide, source of aluminum oxide, structure directing agent, hydroxide ions, and water, and subjecting reaction mixture to crystallization conditions.",DIIDW:2017732825,
CN109574839-A; WO2019061358-A1; US2020239401-A1; EP3689848-A1; EP3689848-A4; CN109574839-B; US11292761-B2; EA42639-B1,"Production of methyl acetate and/or acetic acid from synthesis gas involves passing feedstock containing synthesis gas into reaction zone, contacting with metal catalyst and treating resulting effluent in zone containing solid acid catalyst.",DIIDW:2019334949,
CN116265396-A,"Low-temperature synthesis of high silicon zeolite socony mobil-5 zeolite involves mixing raw material containing aluminum source, silicon source and seed crystal with alkali, water and ethanol, carrying out hydro-thermal crystallizing and drying.",DIIDW:202368207B,
WO200104237-A2; US6222087-B1; AU200059287-A; BR200012385-A; EP1200537-A2; CN1360623-A; KR2002052167-A; JP2003517505-W; MX2002000372-A1; IN200200014-P3; WO200104237-A3,"Converting hydrocarbon feed for use as fuel, includes olefins and paraffins to product comprising light olefins, comprises contacting the feed with catalyst comprising zeolite ZSM-5 and/or -11 and phosphorus under specified conditions.",DIIDW:2001138324,
CN120132892-A,"Catalyst for field of directly preparing liquid fuel by synthesis gas, has active component of first component is metal oxide, second component is medium-pore zeolite molecular sieve or medium-pore zeolite molecular sieve modified by heteroatom compounded together in mechanical mixing manner.",DIIDW:2025626538,
CN103787363-A; CN103787363-B,"Synthesizing fly ash sodium-X zeolite and hydroxysodalite using fly ash filter cake comprises adding sodium hydroxide powder into fly ash, heating, grinding, adding deionized water, centrifuging, separating, washing and crystallizing.",DIIDW:2014N00334,
CN120518094-A,"Preparing tin-beta molecular sieve used in Baeyer-Villiger reaction of cyclohexanone, by uniformly mixing the materials containing tin-Y molecular sieve, beta zeolite seed crystal, silicon source and template agent, crystallizing, washing, drying and calcining to obtain tin-beta molecular sieve.",DIIDW:202589348V,
WO2023161551-A1; ES2950057-A1; ES2950057-B2,"Hybrid zeolitic material used in applications of e.g. catalysis such as waste recovery, pollutant removal, adsorption and/or separation, comprises structure formed by combination of different zeolitic structural units, where hybrid zeolitic material is partially or substantially amorphous.",DIIDW:2023917836,
US7825164-B1,Converting synthesis gas to liquid hydrocarbons in single reactor involves contacting feed comprising a mixture of carbon monoxide and hydrogen having specific hydrogen/carbon monoxide ratio with catalyst bed.,DIIDW:2010N67393,
WO2003018519-A1; US2003045591-A1; GB2382081-A; ZA200206693-A; NL1021320-C2; GB2382081-B; US6703429-B2; BR200212131-A; AU2002326622-A1; AU2002300514-A1; JP2005501139-W; AU2002300514-B2,Conversion of synthesis gas into hydrocarbonaceous products involves subjecting first portion of gas to dual functional syngas conversion process and second portion to Fischer-Tropsch synthesis process.,DIIDW:2003312860,
CN111592008-A,"In-situ hydrothermal synthesis of iron-small-pore zeolite of chabazite molecular sieve involves adding divalent metal salt to organic amine for complexation reaction, adding inorganic base and trivalent aluminum source, aging and roasting.",DIIDW:2020857822,
WO2024185654-A1; JP2025505276-X; JP7727983-B2; AU2024231187-A1,"Method for supplying synthesis gas containing hydrogen gas and carbon oxide gas to catalyst for producing hydrocarbons, involves supplying synthesis gas to catalyst as gas containing poisonous substance which is poisonous to catalyst.",DIIDW:202494529V,
CN110642265-A; CN110642265-B,"Synthesizing heteroatom-containing Pentasil aluminosilicate zeolite molecular sieve by obtaining mixture of e.g. silicon and aluminum, mixing mixture with organic amine template agent, crystallizing and carrying out solid-liquid separation.",DIIDW:202004066K,
KR2021028963-A,"Hydroxyapatite-zeolite complex useful for purification of air and water, synthesized by mixing industrial by-product fine powder, phosphoric acid solution, and alkaline metal hydroxide solution.",DIIDW:2021281353,
JP2007105606-A,"Manufacture of high concentrated ozone gas used for bleaching pulp, involves adsorbing ozone using adsorption agent chosen from pentasil-type borosilicate, mesoporous-type silicoalumino phosphate and/or pentasil-type zeolite.",DIIDW:2007400513,
CN116672434-A,"Antibacterial peptide loaded zeolitic imidazolate frameworks-8 (ZIF-8) nano complex used in preparing antitumor medicine, comprises ZIF-8 zeolite imidazole ester framework and antibacterial peptide.",DIIDW:202395307M,
CN110743611-A; CN110743611-B,"Nano composite catalyst comprises solid solution oxide, spinel oxide and multi-stage pore zeolite molecular sieve.",DIIDW:202011763J,
EP753483-A1,Mfr. of zeolite useful in hydrocarbon conversion and adsorption by forming synthesis mixt. free of organic structure directing agent and contg. seed crystals of zeolite and subjecting to hydrothermal treatment.,DIIDW:1997079311,
CN115055158-A; CN115055158-B,"Synthesizing metal ion modified zeolite capable of efficient magnetic separation, comprises e.g. drying natural zeolite, mixing soluble salt of metal ion with zeolite particles and magnetic ore powder particles, adding ball milling aid, and using steel balls as grinding medium in ball mill.",DIIDW:2022C20495,
US2018002265-A1; WO2018004992-A1; US9981896-B2,"Producing dimethyl ether, comprises introducing at least one feed stream comprising methane and carbon dioxide into a reformer to generate synthesis gas, and converting synthesis gas to dimethyl ether in one step.",DIIDW:2018009900,
JP2020089814-A; JP7353751-B2,"Catalyst structure used for manufacturing hydrocarbon, comprises functional substances, and porous-structure-support comprising zeolite-type compound, and aluminum and silicon in preset atomic ratio, and mutually-connected channel.",DIIDW:2020504571,
CN103008000-A; CN103008000-B,"Non-zeolite molecular sieve Fischer-Tropsch synthesis catalyst comprises active metal component consisting of iron and/or cobalt, non-zeolite molecular sieve and heat-resistant inorganic oxide matrix.",DIIDW:2013P12552,
CN1854066-A; CN100497174-C,"Synthesis of zeolite molecular sieves preparation, involves synthesizing zeolite molecular sieve, gluing, crystallizing, filtering to obtain zeolite molecular sieve.",DIIDW:2007208781,
EP982063-A1; FR2782461-A1; JP2000061239-A; CN1249960-A; US6261344-B1; EP982063-B1; DE69925683-E,"Pressure swing adsorption for the separation of gaseous flow by preferential adsorption uses a faujasite zeolite adsorbent containing mainly lithium ions, also including other alkali and alkaline earth cations.",DIIDW:2000184822,
DE19827949-A1; FR2765207-A1; FR2765208-A1; KR99007324-A; US6153548-A; US6350370-B1; KR546454-B1; IN9801410-I4,"Production of modified zeolite catalyst used in hydrocarbon e.g. poly(alpha-olefin) conversion, comprises treating zeolite obtained by synthesis with an acid solution.",DIIDW:1999082831,
JP2020142974-A; US2020283303-A1; US11124422-B2; JP7297475-B2,"Sol used for zeolite synthesis and forming zeolite membrane, comprises particles comprising aluminum source, and water containing phosphorus source, structure defining agent and carboxylic acid, and solvent in which particles are dispersed.",DIIDW:2020882105,
CN1220914-A; CN1069554-C,"ZSM-5 zeolite and porous metal composite material preparation - involves contacting porous metallic carrier with zeolite synthesis liquid, and crystallizing the liquid at conventional temperatures to produce ZSM-5 zeolite.",DIIDW:1999519120,
CN103933871-A; CN103933871-B,"Making high silica MFI type zeolite membrane by forming zeolite seed crystal using fluoride salt and tetrapropylammonium bromide, crushing by ball milling, then coating on support surface and preparing membrane by secondary growth method.",DIIDW:2014S51021,
JP58213626-A,Alpha-type zeolite prodn. - by hydrothermal synthesis from natural zeolite with addn. of alkali and sodium aluminate.,DIIDW:1984021458,
IT1251836-B,Rapid synthesis of zeolite - used for treatment of acidic noxious wastes.,DIIDW:1995375879,
WO200138224-A1; US6261534-B1; AU200114499-A; EP1152979-A1; EP1152979-B1; DE60013778-E,"Preparation of crystalline zeolite having X-ray diffraction line involves heating template-free reaction mixture containing active source of specific oxides and water, in absence of added external liquid phase.",DIIDW:2001397866,
WO2013037017-A1; US2013102041-A1; EP2757158-A1; EP2757158-A4; EP2757158-B1,"Enzymatic synthesis of estolides involves reacting stearic acid and methyl ricinoleate in solvent free medium, where immobilized lipase is utilized as catalyst, and mixture of stearic acid and methyl ricinoleate is also prepared.",DIIDW:2013E16360,
CN109437225-A,"Synthesis of high silica zeolite molecular sieve includes mixing silicon source, aluminum source, templating agent, sulfuric acid and deionized water, performing hydrothermal reaction, filtering, calcining and performing ion-exchange.",DIIDW:2019249177,
US2018155203-A1; WO2018102555-A1; CN110139829-A; EP3548432-A1; BR112019011324-A2; JP2020513394-W; US10654724-B2; JP7125937-B2; BR112019011324-B1; CN110139829-B,Manufacturing second aqueous aluminum complex composition for use as e.g. inorganic supports by combining water-soluble aluminum salt and acid and contacting aqueous aluminum complex composition with water-insoluble anion exchange resin.,DIIDW:201845100C,
EP356560-A; JP2074517-A; AU8821814-A; CN1041543-A,Ultra-hydrophobic zeolite useful as catalyst support - comprises Y-zeolite subjected to secondary synthesis procedure followed by single steaming step.,DIIDW:1990068480,
CN120155235-A,"Preparing protonated zeolite socony mobil-5 molecular sieve modified catalyst used to catalyze ethylbenzene and ethylene as raw materials to synthesize p-diethylbenzene, involves e.g. carrying out lanthanum oxide metal load to catalyst, and performing two silicon deposition modification.",DIIDW:2025637516,
US2006034757-A1; US7691514-B2,"Method of forming polymer/zeolite nanocomposite membrane (A), useful in fuel cells, comprises forming and combining zeolite nanocrystal and polymer source suspensions; ultrasonicating and heating the solution; and removing the membrane.",DIIDW:2006163779,
FR3003562-A1; ZA201401770-A; FR3003562-B1,"Hydroisomerization of a paraffinic load produced by Fischer-Tropsch synthesis, for producing kerosene and/or diesel bases, using a catalyst including hydro-dehydrogenating metal and a support including zeolite Nu-10 and silica-alumina.",DIIDW:2014R63567,
US2013028801-A1; US9101900-B2,"System for producing synthesis gas, Fischer-Tropsch synthesis products, power, and chemicals comprises dual fluidized bed gasification apparatus having gasifier and combustor; and apparatus e.g. power production apparatus, oxidation reactor.",DIIDW:2013B64290,
US2005054865-A1,"Catalyst, for epoxidation reactions, is obtained by partially crystallizing solid material containing zeolite, separating and/or concentrating solid material, and calcining solid material.",DIIDW:2005221985,
US2024270664-A1; WO2024173314-A1,"Converting alkenes to higher liquid products involves contacting alkenes with MFI zeolite having specific silicon to aluminum ratio, and oligomerizing one or more alkenes in presence of MFI zeolite to form oligomer.",DIIDW:202487225X,
CS8605555-A,Crystalline zeolite prodn. - by hydrothermal synthesis in presence of seeding material.,DIIDW:1987221832,
CN108117088-A,"Preparing zeolite molecular sieve membrane by in situ method comprises e.g. dissolving aluminum source and silicon source in aqueous tetraethylammonium hydroxide solution, adding tetramethylammonium chloride, cleaning and drying.",DIIDW:201845505X,
CN107998404-A; CN107998404-B,"Folic acid-targeting carrier loaded with anticancer drug, produced by synthesizing zinc nitrate, 2-methylimidazole and anticancer drug to obtain anticancer drug-zeolite imidazole framework carrier and linking with folic acid.",DIIDW:201836559X,
WO2020253712-A1; CN112108180-A,"Catalyst useful for producing low-carbon olefin by directly converting synthesis gas, comprises component containing perovskite structure oxide, and component containing acidic molecular sieve with chabazite or AEI topological structure.",DIIDW:2020C8095S,
CN117430129-A,"Synthesizing a copper/rare earth-SSZ-13 molecular sieve by one-step crystal transformation of low-cost zeolite, comprises useful in ammonia selective catalytic reduction reaction, comprises e.g. dispersing copper and tetraethylenepentamine and rare earth metal in deionized water and stirring.",DIIDW:202412618Q,
ES2124142-A1; ES2124142-B1,Synthesis of beta-zeolite - involves preparing reaction mixture in medium free of alkaline cations.,DIIDW:1999098162,
WO2009074804-A1; EP2070894-A1,"Conversion process of n-butanol for high octane fuel, involves dehydrating and isomerizing butanol feedstock in presence of zeolite catalyst having unidirectional and non-intersecting channel, and producing preset amount of isobutene.",DIIDW:2009K48390,
US2020061592-A1; WO2020046632-A1; CA3108901-A1; CN112585092-A; EP3844104-A1; US11318450-B2; EP4180396-A2; EP4201883-A2; EP4201883-A3; JP2024109783-A; JP7544689-B2; EP4180396-A3; CN112585092-B,"Preparing crystals of molecular sieve involves combining source of tetravalent element X, morphology modifier L, and water to form synthesis mixture, heating synthesis mixture under crystallization conditions.",DIIDW:202017470M,
CN1124716-A,Synthesis of 4A zeolite with high exchange capacity.,DIIDW:1997513471,
CN103145145-A; CN103145145-B,"Synthesizing silicoaluminophosphate-34 molecular sieve by using type-A zeolite as silicon source, comprises uniformly mixing e.g. aluminum source to obtain synthetic gel, performing hydro-thermal crystallization, separating, and drying.",DIIDW:2013R74730,
US2015118148-A1; US9718048-B2,Preparing an exfoliated layered zeolite precursor material by preparing a non-aqueous mixture of chloride and fluoride anions comprising an organic solvent and a layered oxide material to be delaminated.,DIIDW:2015272572,
CN114749202-A; CN114749202-B,"Core-shell type SAPO-34-ZSM-5 zeolite catalyst comprises nano-polycrystalline aggregates as core and ZSM-5 zeolite as shell, where zeolite catalyst is based on SAPO-34 microspheres formed by stacking of nano-polycrystalline aggregates as core.",DIIDW:202294787U,
WO2015080452-A1; KR2015062248-A; CN105358252-A; EP3075450-A1; US2016296918-A1; EP3075450-A4; US9815046-B2; KR1816787-B1; CN105358252-B; EP3075450-B1,"Manufacture of activated Fischer-Tropsch synthesis catalyst used for manufacturing liquid/solid hydrocarbon, involves reducing Fischer-Tropsch synthesis catalyst using reducing gas and injecting reduced catalyst into liquid hydrocarbon.",DIIDW:201532274W,
WO2023277573-A1; KR2023006184-A; KR2580498-B1,"System for converting carbon dioxide to hydrocarbon, has reaction unit for performing reverse water gas shift reaction and Fischer-Tropsch synthesis by introducing carbon dioxide and hydrogen, reaction unit for oligomerization, separation unit, and reaction unit for generating synthetic natural gas.",DIIDW:202302924T,
WO2023274289-A1; CN115557829-A; CN115557829-B; ID202401864-A,"Co-production of methanol and ethanol from synthesis gas, comprises e.g. introducing synthesis gas and dimethyl ether into first reactor, and reacting with solid acid catalyst to obtain effluent containing methyl acetate and acetic acid.",DIIDW:2023028120,
CN117985734-A; CN117985734-B,"Preparing nano-EUO type zeolite molecular sieve, comprises e.g. mixing aluminum source, inorganic alkali, water and template agent with mixture of silicon source and organic solvent to perform dynamic hydrothermal reaction.",DIIDW:2024501254,
CN104338550-A; CN104338550-B,"Preparation of alkyl nitrite involves supplying feedstock containing alkanol solution and nitrogen monoxide to column reactor, and contact-reacting mixture with activated carbon-based catalyst in presence of dilute nitric acid.",DIIDW:2015210484,
DD233556-A,Lower olefin prepn. from synthesis gas - using catalyst converting synthesis gas to oxygen-contg. zeolite.,DIIDW:1986169807,
DE4440032-A1; DE4440032-C2,"Supported zeolite(s) used as catalysts - comprises inorganic carrier having pore structure, whose surface is completely coated with polymeric and/or polycondensed carbon@ cpds..",DIIDW:1996240027,
CN103288099-A; CN103288099-B,"Synthesizing nano-NaX type of zeolite comprises mixing aluminum oxide, silicon dioxide, sodium oxide and water and then heating, and mixing silicon source, sodium hydroxide and water with aluminum source and then stirring and aging.",DIIDW:2013V59832,
WO2017012244-A1; CN106365994-A; CA2993146-A1; AU2015403142-A1; IN201827001239-A; EP3326994-A1; US2018201568-A1; EP3326994-A4; JP2018524375-W; US10087135-B2; BR112018001168-A2; ID201807507-A; CN106365994-B; EP3326994-B1; JP6523550-B2; ZA201800636-A; AU2015403142-B2; EA35233-B1; CA2993146-C; IN364939-B; BR112018001168-B1; UZ6503-C; TR201907338-T4; SA8554-B1; SA518390759-A; TH105114-B,"Production of fatty acid alkyl ester for e.g. producing alcohol, involves subjecting alkyl ether to carbonylation reaction with carbon monoxide-containing feed gas in reactor containing acidic EMT zeolite molecular sieve as catalyst.",DIIDW:201708069B,
US2025214851-A1,"Synthesizing porous crystalline material e.g. zeolites, involves forming homogeneous aqueous mixture of precursors and reagents effective for porous crystalline material or effective for different type or sub-type of porous crystalline material.",DIIDW:202566818X,
CN118437385-A,"Synthesizing Zeolite Socony Mobil composites involves uniformly mixing zeolite Socony Mobil, silicon and aluminum sources, processing dynamically and statically, separating solid substance and drying, mixing solid substance with inorganic alkali, and evaporating to prepare dry glue.",DIIDW:202491880G,
RO71730-A,Vinyl chloride synthesis catalyst contg. mercury oxide on zeolite support and prepd. by hot mercuric chloride soln. addn. during zeolite synthesis.,DIIDW:1982002483,
JP11343255-A,Contact hydration of olefin used for manufacture of alcohol - involves using zeolite which is regenerated in hydrothermal synthesis condition using an alkaline water solution containing sulphate radical.,DIIDW:2000185450,
CN120644233-A,"Catalyst used in direct synthesis of deuterated ethanol-d6 from deuterated mixed sugar solution, comprises active component which is rhodium and/or palladium, auxiliary agent which is chromium, zinc, iron, ruthenium and/or indium, and carrier which is modified pentasil aluminosilicate zeolite.",DIIDW:202597249M,
CN120057946-A,"Synthesizing ZSM-23 zeolite molecular sieve with low silicon-aluminum ratio and short shaft nanocrystal shape, involves mixing silicon oxide source, aluminum oxide source, template agent, alkali metal source and water to form initial gel, heating initial gel, filtering, drying and roasting product.",DIIDW:202557895U,
BR201001211-A2; BR201001211-B1,"Aluminosilicate zeolite synthesis involves performing crystallization of crystalline material mixture containing silica source, aluminum source, sodium source and structure directing agent.",DIIDW:2012E72364,
WO2020261795-A1; CN114007725-A; JP2021527463-X; US2022241732-A1; JP7321260-B2; US12226741-B2,"Zeolite film composite body for separating component from mixed fluid, is provided with porous base material and zeolite film formed on surface of porous base material, where zeolite film has LTA type crystal structure.",DIIDW:202101051W,
DD113203-A,Hydrothermal synthesis of zeolites - from inferior materials purified by treatment with acids.,DIIDW:197546264W,
CN101250092-A,"Synthesis of carboxyl aromatic ether involves reacting alkyl aromatic ether and peroxide in presence of catalyst and solvent such as ketone, ether, ethanol or nitrile, or mixture solvent of ketone, ether, ethanol or nitrile.",DIIDW:2008N25568,
NL6900515-A; GB1205449-A; FR2028633-A; GB1218883-A; SU346853-A,Mixtures for use in synthesis of crystalline zeolite molecular sieves.,DIIDW:197051575R,
US7982084-B1,"Hydrocarbon conversion process e.g. de-alkylation and dewaxing, involves contacting a hydrocarbon stream with a catalyst comprising specific microporous crystalline zeolite having three-dimensional framework of alumina/silica.",DIIDW:2011J33663,
WO2016116611-A1; AU2016208485-A1; CA2973638-A1; IN201717028988-A; US2018002610-A1; MX2017009128-A1; CN107635952-A; BR112017014356-A2; US10150718-B2; ZA201704393-A; ZA201704394-A; EA35172-B1; AU2016208485-B2; CA2973638-C; BR112017014356-B1; MX382595-B,"Production of hydrocarbons for use as feed or blendstock in refineries involves converting feed stream containing alcohols and/or ethers over metal-containing zeolite-based catalyst, separating effluent, and removing a part of hydrogen.",DIIDW:201646136Q,
KR2018101790-A; KR1927610-B1,"Producing zeolite used to separate cesium, comprises e.g. dissolving e.g. silicon oxide in distilled water, hydrothermally synthesizing obtained synthetic mother liquid by heat treating, cooling, and filtering to recover solid product.",DIIDW:201874003Q,
CN103012042-A,"Use of biomass for the preparation of light olefins, includes drying biomass, crushing into low-temperature carbonization furnace, pyrolyzing, sending pyrolysis gas into high-temperature gasifier, and pulverizing charcoal.",DIIDW:2013N70711,
FR2795406-A1; US6528695-B1,Process for a three stage production of a xylene isomer from an 8C aromatic fraction includes an isomerization stage with a zeolite EUO-based catalyst and a transalkylation stage.,DIIDW:2001171329,
CN105080595-A; CN105080595-B,"Preparation of special catalyst used for synthesizing ethylenediamine piperazine involves preparing ion exchange solution, filtering, drying, adding binder, soaking in sodium hydroxide solution, soaking, filtering, drying, and calcining.",DIIDW:201581053T,
ID201606894-A,"Preparing synthetic zeolite from bauxite wash waste involves washing bauxite crude in a rotary drum scrubber to obtain larger washable bauxite and sized retained certain mesh and passing over certain mesh, and passing over certain mesh.",DIIDW:201783210H,
WO2003089392-A1; US6638892-B1; AU2002323609-A1,"Conversion of syngas to dimethyl ether or light olefins comprises contacting syngas with catalyst comprising zinc oxide, copper oxide, aluminum oxide, Y zeolite and clay.",DIIDW:2003865426,
WO2025125026-A1; FR3156674-A1,Preparing catalyst based on zeolite i.e. Idemitsu zeolite material type 10 of structural type AEI and transition metal involves taking mixture in aqueous medium of zeolite of structural type having silicon dioxide/aluminum oxide.,D,
CN102701898-A; CN102701898-B,"Synthesizing alkyl substituted benzene comprises e.g. selecting a cavity provided with a conductive metal wire of the cylindrical fixed bed catalytic reactor, filling powder catalyst in a metal wire surface, and starting the reactor.",DIIDW:2013A79722,
CN1073661-A; CN1027633-C,"Synthesis of zinc-contg. high-silicon zeolite - using specified zeolite as seed crystal in colloidal system contg. organic amine, water and oxide(s) of sodium, aluminium and silicon.",DIIDW:1994119079,
CN118594599-A,"Preparing hydrogen Zeolite Socony Mobil-5 film-coated bio-carbon catalyst, comprises e.g. soaking and activating biomass by phosphoric acid, dropping silicon source into mixture, mixing molecular sieve precursor with phosphorylated bio-carbon, performing ammonium ion exchange reaction and calcining.",DIIDW:202498578Q,
CN108295672-A; CN108295672-B,"Method for preparing zeolite imidazole metal organic framework-8 film, involves introducing layer of molecular sieve intermediate layer on surface of porous carrier, followed by placing in membrane synthesis solution.",DIIDW:201859150K,
CN113956122-A,"Organic synthesis method based on green chemistry by selecting green synthesis raw material, i.e. dimethyl carbonate, which can replace phosgene and dimethyl sulfate to organic synthesis; selecting green catalyst; using bis (trichloromethyl) carbonate as stable white crystal.",DIIDW:202219048A,
